{
  "checkpoint_version": 1,
  "repo": "example/repo",
  "status": "running",
  "context_budget": {
    "window_tokens": 258400,
    "soft_stop_ratio": 0.5,
    "hard_stop_ratio": 0.65,
    "critical_stop_ratio": 0.75
  },
  "output_firewall": {
    "raw_log_policy": "file_only",
    "max_parent_stdout_lines": 150,
    "max_subagent_final_lines": 150,
    "artifact_root": "artifacts/logs/tranche-mix-example"
  },
  "resume_prompt": "Read this checkpoint and refresh remote truth.",
  "tranche_id": "2026-07-04-spec-only-declared-t01",
  "scope": "user explicitly confirmed a spec-only tranche",
  "items": [
    {
      "issue": 401,
      "state": "running",
      "next_action": "continue queue",
      "pr_kind": "spec"
    },
    {
      "issue": 402,
      "state": "running",
      "next_action": "continue queue",
      "pr_kind": "spec"
    },
    {
      "issue": 403,
      "state": "running",
      "next_action": "continue queue",
      "pr_kind": "spec"
    },
    {
      "issue": 404,
      "state": "running",
      "next_action": "continue queue",
      "pr_kind": "spec"
    }
  ],
  "tranche_mix": {
    "spec_pr_count": 4,
    "impl_pr_count": 0,
    "consecutive_spec_only": 4
  },
  "spec_only_declaration": {
    "scope": "spec-only tranche for GH401-GH404 before any implementation",
    "conversation_marker": "user message: write all four specs first, implementation later"
  }
}
